{
  "year": 2026,
  "region": "NRW",
  "source": "Manually curated test fixture; external source not recorded",
  "holidays": [
    { "date": "2026-01-01", "name": "Neujahr" },
    { "date": "2026-04-03", "name": "Karfreitag" },
    { "date": "2026-04-06", "name": "Ostermontag" },
    { "date": "2026-05-01", "name": "Tag der Arbeit" },
    { "date": "2026-05-14", "name": "Christi Himmelfahrt" },
    { "date": "2026-05-25", "name": "Pfingstmontag" },
    { "date": "2026-06-04", "name": "Fronleichnam" },
    { "date": "2026-10-03", "name": "Tag der Deutschen Einheit" },
    { "date": "2026-11-01", "name": "Allerheiligen" },
    { "date": "2026-12-25", "name": "1. Weihnachtstag" },
    { "date": "2026-12-26", "name": "2. Weihnachtstag" }
  ]
}
